Sheet: Sheet1
A1: C1 | B1: R1
A2: 95.78nF | B2: 32.338 k ohm
E4: 0.02 | F4: 0.2 | G4: 0.5 | H4: 0.75 | I4: 1.25 | J4: 1.6 | K4: 2.5 | L4: 3.5 | M4: 5 | N4: 10 | O4: 20
A5: Freq | B5: 1 | C5: 51 | E5: 1 | F5: of:=[.F4]*51 -> 10.2 | G5: of:=[.G4]*51 -> 25.5 | H5: 38.2 | I5: 63.8 | J5: of:=[.J4]*51 -> 81.6 | K5: of:=[.K4]*51 -> 127.5 | L5: of:=[.L4]*51 -> 178.5 | M5: of:=[.M4]*51 -> 255 | N5: of:=[.N4]*51 -> 510 | O5: of:=[.O4]*51 -> 1020
A6: Vi | B6: 5.07 | C6: 5.07 | E6: 5.07 | F6: 5.07 | G6: 5.07 | H6: 5.07 | I6: 5.07 | J6: 5.07 | K6: 5.07 | L6: 5.07 | M6: 5.07 | N6: 5.07 | O6: 5.07
A7: Vo | B7: 5.07 | C7: 3.54 | E7: 5.03 | F7: 4.78 | G7: 4.44 | H7: 4.06 | I7: 3.24 | J7: 2.77 | K7: 1.94 | L7: 1.46 | M7: 1.04 | N7: 0.521 | O7: 0.27

Sheet: Sheet2
A1: C1 | B1: R1 | C1: RL
A2: 95.78nF | B2: 32.338 k ohm | C2: 21908
E4: 0.02 | F4: 0.2 | G4: 0.5 | H4: 0.75 | I4: 1.25 | J4: 1.6 | K4: 2.5 | L4: 3.5 | M4: 5 | N4: 10 | O4: 20
A5: Freq | B5: 1 | C5: 120 | E5: 1 | F5: of:=[.F4]*120 -> 24 | G5: of:=[.G4]*120 -> 60 | H5: of:=[.H4]*120 -> 90 | I5: of:=[.I4]*120 -> 150 | J5: of:=[.J4]*120 -> 192 | K5: of:=[.K4]*120 -> 300 | L5: of:=[.L4]*120 -> 420 | M5: of:=[.M4]*120 -> 600 | N5: of:=[.N4]*120 -> 1200 | O5: of:=[.O4]*120 -> 2400
A6: Vi | B6: 5.07 | C6: 5.07 | E6: 5.07 | F6: 5.07 | G6: 5.07 | H6: 5.07 | I6: 5.07 | J6: 5.07 | K6: 5.07 | L6: 5.07 | M6: 5.07 | N6: 5.07 | O6: 5.07
A7: Vo | B7: 2.07 | C7: 1.46 | E7: 2.07 | F7: 2 | G7: 1.89 | H7: 1.71 | I7: 1.29 | J7: 1.1 | K7: 0.835 | L7: 0.601 | M7: 0.44 | N7: 0.26 | O7: 0.15

Sheet: Sheet3
A1: C1 | B1: R1 | C1: RL
A2: 95.78nF | B2: 32.338 k ohm | C2: 21908
E4: 0.02 | F4: 0.2 | G4: 0.5 | H4: 0.75 | I4: 1.25 | J4: 1.6 | K4: 2.5 | L4: 3.5 | M4: 5 | N4: 10 | O4: 20
A5: Freq | B5: 1 | C5: 53 | E5: 1 | F5: of:=[.F4]*53 -> 10.6 | G5: of:=[.G4]*53 -> 26.5 | H5: of:=[.H4]*53 -> 39.75 | I5: of:=[.I4]*53 -> 66.25 | J5: of:=[.J4]*53 -> 84.8 | K5: of:=[.K4]*53 -> 132.5 | L5: of:=[.L4]*53 -> 185.5 | M5: of:=[.M4]*53 -> 265 | N5: of:=[.N4]*53 -> 530 | O5: of:=[.O4]*53 -> 1060
A6: Vi | B6: 5.07 | C6: 5.07 | E6: 5.07 | F6: 5.07 | G6: 5.07 | H6: 5.07 | I6: 5.07 | J6: 5.07 | K6: 5.07 | L6: 5.07 | M6: 5.07 | N6: 5.07 | O6: 5.07
A7: Vo | B7: 5.07 | C7: 1.46 | E7: 5.07 | F7: 4.94 | G7: 4.5 | H7: 4.04 | I7: 3.06 | J7: 2.57 | K7: 1.87 | L7: 1.33 | M7: 0.965 | N7: 0.513 | O7: 0.258